{
  "artefacts": {
    "diagnostics": {
      "bytes": null,
      "reason": "boundary_not_reached",
      "relative_path": "diagnostics.json",
      "sha256": null,
      "written": false
    },
    "input": {
      "bytes": null,
      "reason": "boundary_not_reached",
      "relative_path": "config.input.yaml",
      "sha256": null,
      "written": false
    },
    "journal": {
      "bytes": null,
      "reason": "transaction_not_reached",
      "relative_path": ".rheplicant-journal",
      "sha256": null,
      "written": false
    },
    "lock": {
      "bytes": null,
      "reason": "transaction_not_reached",
      "relative_path": ".rheplicant-lock",
      "sha256": null,
      "written": false
    },
    "marker": {
      "bytes": null,
      "reason": "boundary_not_reached",
      "relative_path": ".rheplicant-results.json",
      "sha256": null,
      "written": false
    },
    "provenance": {
      "bytes": null,
      "reason": "boundary_not_reached",
      "relative_path": "provenance.json",
      "sha256": null,
      "written": false
    },
    "resolved_base": {
      "bytes": null,
      "reason": "layer_not_complete",
      "relative_path": "config.resolved.yaml",
      "sha256": null,
      "written": false
    },
    "resolved_variants": []
  },
  "bootstrap": {
    "base_dir": "/work",
    "input_sha256": "5c9536c0f64193f535c425baf9f2c7431b89eb46bab5fb85d4bfcffabb565f43",
    "launch_mode": "cli",
    "presets": [],
    "protocol_version": 1,
    "source_name": "config.yaml",
    "source_path": "/work/config.yaml",
    "source_realpath": "/work/config.yaml"
  },
  "completed_boundaries": [
    {
      "layer": null,
      "stage": "source"
    },
    {
      "layer": null,
      "stage": "serialization"
    }
  ],
  "format_version": 1,
  "inputs": [],
  "path_encodings": [],
  "plugins": [],
  "python_targets": [],
  "resources": [],
  "runs": [],
  "runtime": {
    "actual": {
      "backend": "cpu",
      "jax_enable_x64": false
    },
    "prior_environment": {
      "jax_enable_x64": null,
      "jax_platforms": null
    },
    "requested": {
      "jax_enable_x64": false,
      "platform": "cpu"
    }
  },
  "seeds": [],
  "software": {
    "dependencies": {
      "equinox": {
        "reason": null,
        "version": "1.0"
      },
      "jax": {
        "reason": null,
        "version": "1.0"
      },
      "jaxlib": {
        "reason": null,
        "version": "1.0"
      },
      "numpy": {
        "reason": null,
        "version": "1.0"
      },
      "numpyro": {
        "reason": null,
        "version": "1.0"
      }
    },
    "host": {
      "machine": "test",
      "release": "1",
      "system": "TestOS"
    },
    "python": {
      "executable": "/python",
      "implementation": "CPython",
      "version": "3.12.0"
    },
    "rheplicant": {
      "dirty": false,
      "dirty_reason": null,
      "git_commit": "aaaaaaaaaaaaaaaaaaaaaaaaaaaaaaaaaaaaaaaa",
      "git_commit_reason": null,
      "source_root": "/src",
      "source_root_reason": null,
      "tracked_diff_sha256": "0000000000000000000000000000000000000000000000000000000000000000",
      "tracked_diff_sha256_reason": null,
      "version": "1.0",
      "version_reason": null
    }
  },
  "status": "refused",
  "variants": []
}
